{
  "schemaVersion": 1,
  "inventories": [
    {
      "id": "baseline",
      "path": "baseline.md",
      "sha256": "6d5c853b79830d4cb1cb5b72f1bf6ea123676b245bdca27ce3d6b7c8797c1f3a",
      "origin": "87ead6ff5:docs/research/single-window-behavior-baseline.md"
    },
    {
      "id": "single-window-input-loops",
      "path": "single-window-input-loops.md",
      "sha256": "40a47b0ae685a8a1ee2f1309c76e60722783b05aa494504f47b7a5ed8b88fef7",
      "origin": "docs/research/single-window-input-loops.md"
    },
    {
      "id": "single-window-packet-state",
      "path": "single-window-packet-state.md",
      "sha256": "1e3bcbb6eb15dcd412e206c721a11d85cae5fc8a0d5094430e632f84836db84d",
      "origin": "docs/research/single-window-packet-state.md"
    },
    {
      "id": "remaining-client-input-loops",
      "path": "remaining-client-input-loops.md",
      "sha256": "76f85717b58f8a026a43dab05ee322150abea260f07f38316886186b71d47caf",
      "origin": ".scratch/single-window-sdl3-client/research/remaining-client-input-loops.md"
    },
    {
      "id": "slash-command-grammar-and-dispatch",
      "path": "slash-command-grammar-and-dispatch.md",
      "sha256": "61041690124c847a56b5c5fb14023aa0d8699d595a071d0e93219484fbccf580",
      "origin": ".scratch/single-window-sdl3-client/research/slash-command-grammar-and-dispatch.md"
    },
    {
      "id": "formatted-and-server-driven-surfaces",
      "path": "formatted-and-server-driven-surfaces.md",
      "sha256": "123d9fe4aa501466cf8cd11c5eef285cfb215165aeb298b2d4bd1a40f70f4d72",
      "origin": ".scratch/single-window-sdl3-client/research/formatted-and-server-driven-surfaces.md"
    },
    {
      "id": "renderer-parity",
      "path": "renderer-parity.md",
      "sha256": "0d5120d67e14b0ac5d0099ca461ed49cd43d0fc82786299ab81b5ae8a178be15",
      "origin": ".scratch/single-window-sdl3-client/research/renderer-parity.md"
    },
    {
      "id": "persisted-settings-and-files",
      "path": "persisted-settings-and-files.md",
      "sha256": "677f781dcdb2d2d17ede541a591f27054b8f80d1796583183ab8616e77752e64",
      "origin": ".scratch/single-window-sdl3-client/research/persisted-settings-and-files.md"
    },
    {
      "id": "platform-deltas-and-packaging",
      "path": "platform-deltas-and-packaging.md",
      "sha256": "fa7e900a052606d57b0a513f985ff7c7f5619ecca39926dabd86282024e6cd2b",
      "origin": ".scratch/single-window-sdl3-client/research/platform-deltas-and-packaging.md"
    },
    {
      "id": "source-text-and-server-field-byte-contracts",
      "path": "source-text-and-server-field-byte-contracts.md",
      "sha256": "71585ae2b09367c05ef9ba4b25d24db218fd6f5f430f19231e7efae1d6da0fc3",
      "origin": ".scratch/single-window-sdl3-client/research/source-text-and-server-field-byte-contracts.md"
    },
    {
      "id": "font-map-and-tiles-contract",
      "path": "font-map-and-tiles-contract.md",
      "sha256": "e58033f0d9255a5ba2cd43350dc1837fada78668875c8069ee23a6c81fe60d78",
      "origin": ".scratch/single-window-sdl3-client/research/font-map-and-tiles-contract.md"
    },
    {
      "id": "encoding-font-assets",
      "path": "encoding-font-assets.md",
      "sha256": "77cfb0083de98834f1f2063783d18f101d09ae85658522095609782e59677bab",
      "origin": ".scratch/single-window-sdl3-client/research/encoding-font-assets.md"
    },
    {
      "id": "sv-config-key-draft",
      "path": "sv-config-key-draft.md",
      "sha256": "c19b44b64d7ce99178effe7d21399dc2bc817ffd5b492f72fd08243c750ba45d",
      "origin": ".scratch/single-window-sdl3-client/research/sv-config-key-draft.md"
    },
    {
      "id": "sv-file-ownership-draft",
      "path": "sv-file-ownership-draft.md",
      "sha256": "6dfc58e4a186c938187e6e88f207be28aeb6e8e732d75664c6a0fee56b5893ce",
      "origin": ".scratch/single-window-sdl3-client/research/sv-file-ownership-draft.md"
    },
    {
      "id": "sv-option-ownership-draft",
      "path": "sv-option-ownership-draft.md",
      "sha256": "eca57d336da8decac10b0a1299fb1f588603016fe436cfd0d58e298e5504ce1b",
      "origin": ".scratch/single-window-sdl3-client/research/sv-option-ownership-draft.md"
    },
    {
      "id": "encoding-server-contract",
      "path": "encoding-server-contract.md",
      "sha256": "6215f813cb12c8e7b475f2a51ce5752790de0f0a03e244a221805bdc38880c8d",
      "origin": ".scratch/single-window-sdl3-client/research/encoding-server-contract.md"
    },
    {
      "id": "ui-and-asset-scaling-standards",
      "path": "ui-and-asset-scaling-standards.md",
      "sha256": "fe0cadf233877d66d4506488c14d9637c3d604b49829a24992315b2b6dc3cfd4",
      "origin": ".scratch/single-window-sdl3-client/research/ui-and-asset-scaling-standards.md"
    },
    {
      "id": "pcf-loading-and-scaling-options",
      "path": "pcf-loading-and-scaling-options.md",
      "sha256": "201cb68d79e218d1c8578a5bd0283d1d4205cd9a6a8c8cb7173d91996b8f3a16",
      "origin": ".scratch/single-window-sdl3-client/research/pcf-loading-and-scaling-options.md"
    },
    {
      "id": "secure-credential-storage",
      "path": "secure-credential-storage.md",
      "sha256": "119f658fa031aa7c755989b18af88e549b161c2143f8995bbc50fb356d6a8a84",
      "origin": ".scratch/single-window-sdl3-client/research/secure-credential-storage.md"
    },
    {
      "id": "html-gap-ledger",
      "path": "html-gap-ledger.md",
      "sha256": "7ec9e525f48201645de48a1319508e888284c2e013de4c7b7e405761cc41c8e8",
      "origin": ".scratch/single-window-sdl3-client/research/html-gap-ledger.md"
    },
    {
      "id": "sdl3-tile-composition-and-scaling-apis",
      "path": "sdl3-tile-composition-and-scaling-apis.md",
      "sha256": "68a809516cf3ad1f2ce85f3dc6da22dac17957d3370a1f8f48ad11d64268d2e5",
      "origin": ".scratch/single-window-sdl3-client/research/sdl3-tile-composition-and-scaling-apis.md"
    },
    {
      "id": "history-retention-and-recorder-necessity",
      "path": "history-retention-and-recorder-necessity.md",
      "sha256": "6242ff92b0953f231f9f87b398dbfd63bfb55920130df2cbecd118873842f33f",
      "origin": ".scratch/single-window-sdl3-client/research/history-retention-and-recorder-necessity.md"
    },
    {
      "id": "minimum-platform-facts",
      "path": "minimum-platform-facts.md",
      "sha256": "327b3ed977450ec7227f808bd2bdfec0413f1d562dd64431fdcd4d59821c07f0",
      "origin": ".scratch/single-window-sdl3-client/research/minimum-platform-facts.md"
    },
    {
      "id": "bundled-ttf-candidates",
      "path": "bundled-ttf-candidates.md",
      "sha256": "1de2d9aa63daf7f7166934cbb36d57643e137838d358bb153831d47fff45298e",
      "origin": ".scratch/single-window-sdl3-client/research/bundled-ttf-candidates.md"
    }
  ],
  "sourceFiles": [
    {
      "path": ".github/actions/ci-image-repo/action.yml",
      "sha256": "53fadda92a519f52831d3548e7e7aceda4408e799957f04dc1f1cc0e5af741d1"
    },
    {
      "path": ".github/actions/ci-release-assets/action.yml",
      "sha256": "8f5ada662b72d41f07e5a786b55beb9a3d6414b886428909428814cecd2544bc"
    },
    {
      "path": ".github/actions/ci-resolve-deps-image/action.yml",
      "sha256": "0d4e2c7391300e86001bfdda59700547b1f23da30930723bc1a018d4387fdcb9"
    },
    {
      "path": ".github/actions/ci-verify-assets/action.yml",
      "sha256": "fa92afb1d7211864c05c90371a82735daaedfba68fbeb1315aa3448155769609"
    },
    {
      "path": ".github/actions/ci-version-from-defines/action.yml",
      "sha256": "60ddd789c7f319fe66cfda416d52b36d40a2bf7aec62a8ec86f21cb12080565b"
    },
    {
      "path": ".github/docker/fedora41/Containerfile",
      "sha256": "260bdb5b48d1968d3f7b806461f27957c583deae5b6d3aef09eae53333b8e631"
    },
    {
      "path": ".github/docker/fedora41/install-build-requirements.sh",
      "sha256": "c450982c41336e247369c8d526bfacecab83d61e3d0b6b3a293f2aabb4577df2"
    },
    {
      "path": ".github/docker/fedora41/release-all.sh",
      "sha256": "61b4f309e6caf9b81df934388cfe58fc6a1ec51d9cd2aab4c0eef29ada778e7c"
    },
    {
      "path": ".github/docker/fedora41/release-client-sdl3-linux.sh",
      "sha256": "7b23cb434270b9c372d40ee717f427673d718d7a36fea417779f62ce8d434fd8"
    },
    {
      "path": ".github/docker/fedora41/release-client-sdl3-win32.sh",
      "sha256": "8f9e7ce0c05f8a8b1adbd8b6e25e794c62501fdd1074423534d0897398135d2c"
    },
    {
      "path": ".github/docker/fedora41/release-client-win32.sh",
      "sha256": "92c1ef4df9cd86e3181578d815402403c480e9507825bbd514acd70b9403fdd8"
    },
    {
      "path": ".github/docker/fedora41/release-client-x11-linux.sh",
      "sha256": "1d73d7df2ed9b350788725d8ae0139e585cac36dc59e0cfe7f1193be1b5d0e26"
    },
    {
      "path": ".github/docker/fedora41/release-common.sh",
      "sha256": "8d2c92d53fbadf2003773bd613f027840d300774ef7c564f2897cf44af5502ca"
    },
    {
      "path": ".github/docker/fedora41/release-server-x11-linux.sh",
      "sha256": "e9a8e2102237b2367a96b8b88231374c8b143ecfd67d4d80aaed8924ebbc1c9d"
    },
    {
      "path": ".github/docker/fedora43/Containerfile",
      "sha256": "38c5586840ff8397d1921c2111bcf8e0376b7c07e3ffc3a0eda0b5dac66efbcb"
    },
    {
      "path": ".github/docker/fedora43/install-build-requirements.sh",
      "sha256": "41d3a2fe89dba16d7c1a57653630c0bb76b40c143feb31ae97823bc4efe0f0cb"
    },
    {
      "path": ".github/docker/fedora43/release-all.sh",
      "sha256": "61b4f309e6caf9b81df934388cfe58fc6a1ec51d9cd2aab4c0eef29ada778e7c"
    },
    {
      "path": ".github/docker/fedora43/release-client-sdl3-linux.sh",
      "sha256": "df17db2339bc310214636db85aad914c61e25dd33d1ac7b4e045aedf99a7b86e"
    },
    {
      "path": ".github/docker/fedora43/release-client-sdl3-win32.sh",
      "sha256": "1fef3242557497b34f93892b32d65b5162a4faaa6136e28ba15a63b6cf7b9c22"
    },
    {
      "path": ".github/docker/fedora43/release-client-win32.sh",
      "sha256": "3a1dedbccad04b0167592b217c69a3f080883e6b8120ef917a76c5bd16a564aa"
    },
    {
      "path": ".github/docker/fedora43/release-client-x11-linux.sh",